{
  "schema_version": 1,
  "initiative": "replace-me",
  "work_map": ".claude/plans/replace-me/work.json",
  "charter": ".claude/plans/replace-me/swarm/charter.md",
  "integration_branch": "codex/replace-me",
  "max_parallel": 2,
  "coordinator_paths": ["path/to/project-generated-output"],
  "scope_rules": {
    "worker": "write_scope+own_report",
    "reviewer": "own_review",
    "reducers": "coordinator-only"
  },
  "lanes": [
    {
      "task_id": "P1",
      "wave": 1,
      "role": "Implementer",
      "write_scope": ["path/owned-by-p1"],
      "brief": ".claude/plans/replace-me/swarm/briefs/P1.md",
      "report": ".claude/plans/replace-me/swarm/reports/P1.md",
      "review": ".claude/plans/replace-me/swarm/reviews/P1.md"
    },
    {
      "task_id": "P2",
      "wave": 2,
      "role": "Implementer",
      "isolation": "git-worktree",
      "write_scope": ["path/owned-by-p2"],
      "brief": ".claude/plans/replace-me/swarm/briefs/P2.md",
      "report": ".claude/plans/replace-me/swarm/reports/P2.md",
      "review": ".claude/plans/replace-me/swarm/reviews/P2.md"
    }
  ]
}
