{
  "schema_version": 1,
  "initiative": "reusable-patterns",
  "work_map": ".claude/plans/reusable-patterns/work.json",
  "charter": ".claude/plans/reusable-patterns/swarm/charter.md",
  "integration_branch": "jokerman-microsoft-patterns-core-integration",
  "max_parallel": 3,
  "coordinator_paths": [
    ".claude/plans/todo.md",
    ".claude/memory",
    ".claude/decisions",
    ".claude/engineering",
    "skills/CATALOG.md",
    ".github/skills",
    ".github/agents",
    ".github/lintel",
    ".agents",
    "docs",
    "bin/li-copilot.py",
    "CHANGELOG.md",
    "scaffolding/01-foundation/templates/pattern",
    "skills/pack-create",
    "skills/pack-validate",
    "tests/integration/pattern-portability.py",
    "tests/integration/pattern-portability.sh",
    "tests/shape/pattern-contract.sh"
  ],
  "scope_rules": {
    "worker": "write_scope+own_report",
    "reviewer": "own_review",
    "reducers": "coordinator-only"
  },
  "lanes": [
    {
      "task_id": "CORE",
      "wave": 1,
      "role": "integration owner (core implementer)",
      "isolation": "git-worktree",
      "write_scope": [
        "lib/patterns.py",
        "bin/li-pattern.py",
        "tests/unit/patterns.py",
        "tests/unit/patterns.sh",
        "skills/pattern/SKILL.md"
      ],
      "brief": ".claude/plans/reusable-patterns/swarm/briefs/CORE.md",
      "report": ".claude/plans/reusable-patterns/swarm/reports/CORE.md",
      "review": ".claude/plans/reusable-patterns/swarm/reviews/CORE.md",
      "shared_evidence": {
        "context": ".claude/runtime/swarm/reusable-patterns/CORE/context.json",
        "review": ".claude/runtime/reviews/reusable-patterns-CORE.json",
        "qa": ".claude/runtime/swarm/reusable-patterns/CORE/qa.json",
        "corroboration": ".claude/runtime/swarm/reusable-patterns/CORE/corroboration.json",
        "domain_request": null,
        "review_skill": "review"
      }
    },
    {
      "task_id": "PACK",
      "wave": 1,
      "role": "lintel-builder",
      "isolation": "git-worktree",
      "write_scope": [
        "lib/profile_context.py",
        "lib/pack-resolver.sh",
        "lib/paths.sh",
        "bin/li-pattern",
        "packs/_default/pack.yaml",
        "lib/pack-schema.yaml",
        "tests/unit/pattern-pack-origins.sh",
        "tests/unit/pattern-roots.py",
        "tests/unit/pattern-roots.sh"
      ],
      "brief": ".claude/plans/reusable-patterns/swarm/briefs/PACK.md",
      "report": ".claude/plans/reusable-patterns/swarm/reports/PACK.md",
      "review": ".claude/plans/reusable-patterns/swarm/reviews/PACK.md",
      "shared_evidence": {
        "context": ".claude/runtime/swarm/reusable-patterns/PACK/context.json",
        "review": ".claude/runtime/reviews/reusable-patterns-PACK.json",
        "qa": ".claude/runtime/swarm/reusable-patterns/PACK/qa.json",
        "corroboration": ".claude/runtime/swarm/reusable-patterns/PACK/corroboration.json",
        "domain_request": null,
        "review_skill": "review"
      }
    },
    {
      "task_id": "WF",
      "wave": 1,
      "role": "lintel-builder",
      "isolation": "git-worktree",
      "write_scope": [
        "skills/sense/SKILL.md",
        "skills/scope/SKILL.md",
        "skills/define/SKILL.md",
        "skills/discover/SKILL.md",
        "skills/cycle/SKILL.md",
        "skills/plan/SKILL.md",
        "skills/build/SKILL.md",
        "skills/resume/SKILL.md",
        "skills/review/SKILL.md",
        "skills/ship/SKILL.md",
        "skills/capture/SKILL.md",
        "skills/generate/SKILL.md",
        "skills/generate-outline/SKILL.md",
        "skills/generate-write/SKILL.md",
        "skills/generate-design/SKILL.md",
        "skills/generate-qa/SKILL.md",
        "skills/generate-word/SKILL.md",
        "skills/generate-ppt/SKILL.md",
        "skills/generate-pdf/SKILL.md",
        "skills/generate-xlsx/SKILL.md",
        "skills/generate-visio/SKILL.md",
        "skills/ta/SKILL.md",
        "skills/da/SKILL.md",
        "skills/sc/SKILL.md",
        "skills/dh/SKILL.md",
        "skills/tq/SKILL.md",
        "skills/frontend-style-extract/SKILL.md",
        "skills/generate-style-learn/SKILL.md",
        "skills/frontend-design/SKILL.md",
        "skills/generate-web/SKILL.md",
        "skills/design-dna/SKILL.md",
        "skills/frontend-typography/SKILL.md",
        "skills/frontend-motion/SKILL.md",
        "skills/frontend-shader/SKILL.md",
        "skills/generate-app/SKILL.md",
        "skills/frontend-design-review/SKILL.md",
        "skills/pattern/references",
        "lib/pattern_visual.py",
        "tests/integration/pattern-workflows.py",
        "tests/integration/pattern-workflows.sh",
        "tests/unit/pattern-visual.py",
        "tests/unit/pattern-visual.sh",
        "tests/integration/pattern-visual-roundtrip.py",
        "tests/integration/pattern-visual-roundtrip.sh"
      ],
      "brief": ".claude/plans/reusable-patterns/swarm/briefs/WF.md",
      "report": ".claude/plans/reusable-patterns/swarm/reports/WF.md",
      "review": ".claude/plans/reusable-patterns/swarm/reviews/WF.md",
      "shared_evidence": {
        "context": ".claude/runtime/swarm/reusable-patterns/WF/context.json",
        "review": ".claude/runtime/reviews/reusable-patterns-WF.json",
        "qa": ".claude/runtime/swarm/reusable-patterns/WF/qa.json",
        "corroboration": ".claude/runtime/swarm/reusable-patterns/WF/corroboration.json",
        "domain_request": null,
        "review_skill": "review"
      }
    }
  ]
}
